record_id,budget_year,budget_cycle,submission_date,service_agency_name,service_agency_acronym,appropriation_code,appropriation_name,appropriation_type,exhibit_type,source_file,file_format,data_lifecycle_stage,line_item_number,line_item_title,budget_activity_number,budget_activity_title,budget_sub_activity_number,budget_sub_activity_title,program_element,cost_all_prior_years,cost_prior_year,cost_current_year,cost_fy2027,cost_fy2028,cost_fy2029,cost_fy2030,cost_fy2031,cost_units,description,justification,usaspending_federal_account,program_activity_code,treasury_account_symbol
26daf124eca9,2027.0,PB,2026-04,Chemical and Biological Defense Program,CBDP,0300D,"Procurement, Defense-Wide",Procurement,P-40,PROC_CBDP_PB_2027.xml,XML,Budget Request,7001SA1000,Chemical Biological Situational Awareness,3,Chemical/Biological Defense,1,CBDP,,1392.45,171.841,208.051,223.166,221.579,261.49,298.368,304.376,Millions,The Situational Awareness (Understand) Portfolio enhances commanders' tactical and operational decisions by developing and fielding stronger detection and identification capabilities for Chemical Biol...,"Situational Awareness is a primary objective of the Chemical Biological Defense Program.  Operational forces must safely operate, survive, and sustain operations in a chemical and biological agent thr...",,,
94ec2fc1c9d1,2027.0,PB,2026-04,Defense Advanced Research Projects Agency,DARPA,0400,"Research, Development, Test & Evaluation, Defense-Wide",RDT&E,R-2,RDTE_Vol1_DARPA_MasterJustificationBook_PB_2027.xml,XML,Budget Request,,EMERGING OPPORTUNITIES,1,Basic Research,,,0601122E,0.0,0.0,345.053,387.633,423.322,427.802,436.873,445.964,Millions,,,,,
0a8a53929443,2027.0,PB,April 2026,Department of War,CMP,0100D,Department of War,O&M,OP-5,CMP_OP-5.json,JSON,Budget Request,,Innovative Readiness Training Program,,CMP,,,,,6.798,15.557,16.847,,,,,Millions,,,,,
eae358439cb4,2027.0,PB,April 2026,Defense Working Capital Funds,DeCA,3840f,Defense Working Capital Funds,DWCF,RF-1,DeCA_PB27_J-Book.json,JSON,Budget Request,,DeCA,,,,,,,,,,,,,,Millions,Defense Commissary Agency,,,,
6fde6c6e86d9,2027.0,PB,2026-04,Defense Health Agency,DHA,0130D,Combat & Operational Medicine Program,DHP,DHP-J-Book,MHS_PB27_J-Book-Vol1-COMP_PSCP.xml,XML,Budget Request,,,01,Operation & Maintenance,010,In-House Care,,,10294.476,10735.135,10863.317,,,,,Millions,,,,,
374ca6e2e5f0,2027.0,PB,2026-04,Department of the Army,Army,2020A,Defense Health Program — Army Medical Readiness,DHP,DHP-SMR,MHS_PB27_J-Book-Vol2-SMR.xml,XML,Budget Request,,Army Medical (IM/IT),124,,,Medical Operations Support,,,,15.887,12.904,,,,,Millions,,,,,
